<?xml version="1.0" encoding="UTF-8"?>
<!-- Exemple au format 2 : migration de mkconf_tauon_basic_nucleo_f439zi.xml (clone noyau 6b62af5).
     Retirés : <target>, <arch dest_path> (sortie -o de CMake), <arch include_absolute_path>
     (manifeste BSP, entete_config_noyau), <cpu freq> (manifeste BSP, frequence_cpu).
     Les deux sections <devices> sont fusionnées ; l'ordre des pilotes est conservé. -->
<mklepton version="2"
          xmlns:xsi="http://www.w3.org/2001/XMLSchema-instance"
          xsi:noNamespaceSchemaLocation="../../mklepton.xsd">

<kernel>
      <heap size="10000" />
      <process max="16" />
      <openfiles max="32" />
      <descriptors max="16" />
      <!-- rootfs en flash (filecpu_memory, const) -->
      <cpufs size="128000" node="256" blocksz="256" block="16"/>
      <env path="/usr;/usr/sbin;/usr/bin" />
      <network use="on" />
</kernel>

<devices>
   <dev name="dev_null_map"                 use="on"/>
   <dev name="dev_proc_map"                 use="on"/>
   <dev name="dev_cpufs_map"                use="on"/>
   <dev name="dev_head_map"                 use="on"/>
   <dev name="dev_pipe_map"                 use="on"/>
   <dev name="dev_lwip_core_socket_map"     use="on"/>
   <dev name="dev_lwip_stack_map"           use="on"/>
   <dev name="dev_nucleo_f439zi_board_map"  use="on"/>
   <dev name="dev_nucleo_f439zi_uart_3_map" use="on"/>
   <dev name="dev_nucleo_f439zi_uart_6_map" use="on"/>
   <dev name="dev_stm32f4xx_eth_map"        use="on"/>
</devices>

<binaries src_path="sbin" dest_path="sbin">
   <bin name="initd"    stack="2048"    priority="100" timeslice="1" />
   <bin name="lsh"      stack="2048"    priority="100" timeslice="1" />
   <bin name="mount"    stack="2048"    priority="100" timeslice="1" />
   <bin name="umount"   stack="2048"    priority="100" timeslice="1" />
   <bin name="ls"       stack="2048"    priority="100" timeslice="1" />
   <bin name="ps"       stack="2048"    priority="100" timeslice="1" />
   <bin name="kill"     stack="2048"    priority="100" timeslice="1" />
   <bin name="cat"      stack="2048"    priority="100" timeslice="1" />
   <bin name="uname"    stack="2048"    priority="100" timeslice="1" />
   <bin name="pwd"      stack="2048"    priority="100" timeslice="1" />
   <bin name="echo"     stack="2048"    priority="100" timeslice="1" />
</binaries>

<binaries src_path="sbin/net" dest_path="sbin/net">
   <bin name="ifconfig" stack="4096"    priority="100" timeslice="1" />
   <bin name="tsterrno" stack="2048"    priority="100" timeslice="1" />
</binaries>

<binaries src_path="bin/net" dest_path="bin/net">
   <bin name="ftpd"     stack="8192"    priority="100" timeslice="1" />
</binaries>

<files>
   <file name=".boot"   src_file="sys/user/tauon-basic/etc/nucleo-f439zi/.boot"   dest_path="etc" />
   <file name=".init"   src_file="sys/user/tauon-basic/etc/nucleo-f439zi/.init"   dest_path="etc" />
</files>

</mklepton>
